{
  "$schema": "./uix7-deterministic-validation-fixtures.schema.json",
  "schema_version": "orchestra.ui-deterministic-validation-fixtures.v1",
  "role": "UIX_7_DETERMINISTIC_VALIDATION_FIXTURES",
  "entry_baseline": "67af42002a18ac3b58811cb2877d285bc8604ce0",
  "source_contracts": [
    "machine/schemas/ui-design-contract.schema.json",
    "machine/ui/ui-profile-registry.v1.json",
    "machine/ui/component-asset-preservation-contract.v1.json",
    "machine/ui/optional-adapter-boundaries.v1.json"
  ],
  "categories": ["COMPONENT_REUSE", "TOKEN_PRESERVATION", "ARBITRARY_VALUE_DRIFT", "STATE_COMPLETENESS", "PROFILE_CONFLICT", "ASSET_PROVENANCE", "RESPONSIVE_CONTAINMENT", "ACCESSIBILITY_INVARIANTS", "REFERENCE_IDENTITY", "VISUAL_BASELINE_REPLACEMENT"],
  "cases": [
    {"case_id":"uix7-component-reuse-pass","category":"COMPONENT_REUSE","expectation":"PASS","failure_code":null,"evidence_refs":["machine/ui/component-asset-preservation-contract.v1.json"],"input":{"existing_component":"Button","requested_component":"Button","implementation_component":"Button","duplicate_created":false}},
    {"case_id":"uix7-component-reuse-duplicate","category":"COMPONENT_REUSE","expectation":"FAIL_CLOSED","failure_code":"COMPONENT_REUSE_VIOLATION","evidence_refs":["machine/ui/component-asset-preservation-contract.v1.json"],"input":{"existing_component":"Button","requested_component":"Button","implementation_component":"NewButton","duplicate_created":true}},
    {"case_id":"uix7-token-preservation-pass","category":"TOKEN_PRESERVATION","expectation":"PASS","failure_code":null,"evidence_refs":["machine/schemas/ui-design-contract.schema.json"],"input":{"source_token_ref":"color.action.primary","implementation_token_ref":"color.action.primary"}},
    {"case_id":"uix7-token-preservation-drift","category":"TOKEN_PRESERVATION","expectation":"FAIL_CLOSED","failure_code":"TOKEN_REFERENCE_DRIFT","evidence_refs":["machine/schemas/ui-design-contract.schema.json"],"input":{"source_token_ref":"color.action.primary","implementation_token_ref":"color.blue.500"}},
    {"case_id":"uix7-arbitrary-value-pass","category":"ARBITRARY_VALUE_DRIFT","expectation":"PASS","failure_code":null,"evidence_refs":["machine/ui/ui-profile-registry.v1.json"],"input":{"project_token_available":true,"arbitrary_value_used":false,"arbitrary_value":null}},
    {"case_id":"uix7-arbitrary-value-drift","category":"ARBITRARY_VALUE_DRIFT","expectation":"FAIL_CLOSED","failure_code":"ARBITRARY_VALUE_WITH_AVAILABLE_TOKEN","evidence_refs":["machine/ui/ui-profile-registry.v1.json"],"input":{"project_token_available":true,"arbitrary_value_used":true,"arbitrary_value":"#3b82f6"}},
    {"case_id":"uix7-state-completeness-pass","category":"STATE_COMPLETENESS","expectation":"PASS","failure_code":null,"evidence_refs":["machine/ui/component-asset-preservation-contract.v1.json"],"input":{"required_states":["default","hover","focus_visible","disabled","error"],"implemented_states":["default","hover","focus_visible","disabled","error"]}},
    {"case_id":"uix7-state-completeness-missing","category":"STATE_COMPLETENESS","expectation":"FAIL_CLOSED","failure_code":"REQUIRED_STATE_MISSING","evidence_refs":["machine/ui/component-asset-preservation-contract.v1.json"],"input":{"required_states":["default","hover","focus_visible","disabled","error"],"implemented_states":["default","hover","disabled"]}},
    {"case_id":"uix7-profile-conflict-pass","category":"PROFILE_CONFLICT","expectation":"PASS","failure_code":null,"evidence_refs":["machine/ui/ui-profile-registry.v1.json"],"input":{"selection":{"foundation":["minimalist"],"layout":["bento_grid"],"full_theme_or_system":["material_3"],"optional_effect":["aurora"]}}},
    {"case_id":"uix7-profile-conflict-full-system","category":"PROFILE_CONFLICT","expectation":"FAIL_CLOSED","failure_code":"PROFILE_COMPOSITION_CONFLICT","evidence_refs":["machine/ui/ui-profile-registry.v1.json","tests/fixtures/ui/uix3-invalid-full-system-mix.json"],"input":{"selection":{"foundation":["minimalist"],"layout":["bento_grid"],"full_theme_or_system":["material_3","dark_cyberpunk"],"optional_effect":[]}}},
    {"case_id":"uix7-asset-provenance-pass","category":"ASSET_PROVENANCE","expectation":"PASS","failure_code":null,"evidence_refs":["machine/ui/component-asset-preservation-contract.v1.json"],"input":{"source_identity":"assets/logo.svg","implementation_source_identity":"assets/logo.svg","substitution_approved":false,"approval_ref":null}},
    {"case_id":"uix7-asset-provenance-unapproved","category":"ASSET_PROVENANCE","expectation":"FAIL_CLOSED","failure_code":"UNAPPROVED_ASSET_SUBSTITUTION","evidence_refs":["machine/ui/component-asset-preservation-contract.v1.json"],"input":{"source_identity":"assets/logo.svg","implementation_source_identity":"generated/logo.svg","substitution_approved":false,"approval_ref":null}},
    {"case_id":"uix7-responsive-containment-pass","category":"RESPONSIVE_CONTAINMENT","expectation":"PASS","failure_code":null,"evidence_refs":["machine/schemas/ui-design-contract.schema.json"],"input":{"viewport_width":390,"content_width":390,"overflow_x":false}},
    {"case_id":"uix7-responsive-containment-overflow","category":"RESPONSIVE_CONTAINMENT","expectation":"FAIL_CLOSED","failure_code":"RESPONSIVE_OVERFLOW","evidence_refs":["machine/schemas/ui-design-contract.schema.json"],"input":{"viewport_width":390,"content_width":428,"overflow_x":true}},
    {"case_id":"uix7-accessibility-invariants-pass","category":"ACCESSIBILITY_INVARIANTS","expectation":"PASS","failure_code":null,"evidence_refs":["machine/ui/ui-profile-registry.v1.json"],"input":{"reduced_motion_respected":true,"forced_colors_respected":true,"interaction_critical_contrast_passed":true}},
    {"case_id":"uix7-accessibility-invariants-fail","category":"ACCESSIBILITY_INVARIANTS","expectation":"FAIL_CLOSED","failure_code":"ACCESSIBILITY_INVARIANT_VIOLATION","evidence_refs":["machine/ui/ui-profile-registry.v1.json"],"input":{"reduced_motion_respected":false,"forced_colors_respected":true,"interaction_critical_contrast_passed":true}},
    {"case_id":"uix7-reference-identity-pass","category":"REFERENCE_IDENTITY","expectation":"PASS","failure_code":null,"evidence_refs":["machine/schemas/ui-design-contract.schema.json"],"input":{"expected_reference_identity":"design:checkout:v3","observed_reference_identity":"design:checkout:v3","expected_revision":"rev-123","observed_revision":"rev-123"}},
    {"case_id":"uix7-reference-identity-mismatch","category":"REFERENCE_IDENTITY","expectation":"FAIL_CLOSED","failure_code":"REFERENCE_IDENTITY_MISMATCH","evidence_refs":["machine/schemas/ui-design-contract.schema.json"],"input":{"expected_reference_identity":"design:checkout:v3","observed_reference_identity":"design:checkout:v2","expected_revision":"rev-123","observed_revision":"rev-119"}},
    {"case_id":"uix7-visual-baseline-pass","category":"VISUAL_BASELINE_REPLACEMENT","expectation":"PASS","failure_code":null,"evidence_refs":["machine/schemas/ui-design-contract.schema.json"],"input":{"prior_comparison_result":"PASS","baseline_replaced":true,"approval_ref":"human-approval:uix7-baseline-refresh","replacement_reason":"Reference revision intentionally advanced after passing comparison."}},
    {"case_id":"uix7-visual-baseline-erase-failure","category":"VISUAL_BASELINE_REPLACEMENT","expectation":"FAIL_CLOSED","failure_code":"FAILING_BASELINE_REPLACEMENT_PROHIBITED","evidence_refs":["machine/schemas/ui-design-contract.schema.json"],"input":{"prior_comparison_result":"FAIL","baseline_replaced":true,"approval_ref":"human-approval:uix7-baseline-refresh","replacement_reason":"Attempted replacement after a failing comparison."}}
  ],
  "authority": {"fixture_result_grants_authority":false,"baseline_change_grants_authority":false,"external_evidence_grants_authority":false,"runtime_integration":false,"dependency_adoption_authorized":false,"figma_mutation_authorized":false,"release_authorized":false}
}
